{
  "schemaVersion": "ocr-research-report.v1",
  "experimentId": "issue-149-bounded-brand-no-op",
  "arm": "control",
  "configuration": {
    "scale": 3,
    "padding": {
      "ratio": 0.03,
      "minPx": 4
    },
    "grayscaleMethod": "sharp-grayscale",
    "contrastMethod": "normalise",
    "thresholdMethod": "none",
    "sharpening": "none",
    "inversion": false,
    "denoising": "none",
    "psm": 11,
    "rotation": 0,
    "cropSource": "governed-brand-region",
    "fieldType": "brandName"
  },
  "configurationHash": "abaf9c70d2db05d49fb3b21073caefced0f95e13e50f7c3446d60277e4dd4a56",
  "behaviorHash": "b3db6f91ea925a60aee0adc043994a5fef1e57df3cb6df03860f038cc16ffb41",
  "gitSha": "e267bdda67293f34131b1c51af556a3f2add91a0",
  "environment": {
    "node": "v22.17.0",
    "platform": "darwin",
    "architecture": "arm64",
    "sharp": "0.35.3",
    "ocrEngine": "tesseract.js@7.0.0/eng/OEM1"
  },
  "metrics": {
    "governedFixtureCount": 10,
    "caseCount": 11,
    "correctCount": 0,
    "failureCount": 11,
    "accuracy": 0,
    "accuracyWilson95": {
      "confidenceLevel": 0.95,
      "lower": 0,
      "upper": 0.2588329669680317
    },
    "falseCertaintyCount": 0,
    "falseCertaintyRate": 0,
    "falseCertaintyWilson95": {
      "confidenceLevel": 0.95,
      "lower": 0,
      "upper": 0.2588329669680317
    },
    "medianLatencyMs": 81.55454099999997,
    "p95LatencyMs": 225.85037499999999,
    "medianRssDeltaBytes": 1523712,
    "failureClassCounts": {
      "OCR_RECOGNITION_MISS": 11
    },
    "sliceMetrics": {
      "crop-min-dimension:large": {
        "caseCount": 4,
        "correctCount": 0,
        "accuracy": 0,
        "accuracyWilson95": {
          "confidenceLevel": 0.95,
          "lower": 0,
          "upper": 0.4898908364545973
        },
        "falseCertaintyCount": 0,
        "falseCertaintyRate": 0,
        "falseCertaintyWilson95": {
          "confidenceLevel": 0.95,
          "lower": 0,
          "upper": 0.4898908364545973
        },
        "medianLatencyMs": 205.97172899999998,
        "p95LatencyMs": 225.85037499999999,
        "failureClassCounts": {
          "OCR_RECOGNITION_MISS": 4
        }
      },
      "crop-min-dimension:medium": {
        "caseCount": 6,
        "correctCount": 0,
        "accuracy": 0,
        "accuracyWilson95": {
          "confidenceLevel": 0.95,
          "lower": 0,
          "upper": 0.39033428790216534
        },
        "falseCertaintyCount": 0,
        "falseCertaintyRate": 0,
        "falseCertaintyWilson95": {
          "confidenceLevel": 0.95,
          "lower": 0,
          "upper": 0.39033428790216534
        },
        "medianLatencyMs": 58.983249500000056,
        "p95LatencyMs": 122.61974999999995,
        "failureClassCounts": {
          "OCR_RECOGNITION_MISS": 6
        }
      },
      "crop-min-dimension:small": {
        "caseCount": 1,
        "correctCount": 0,
        "accuracy": 0,
        "accuracyWilson95": {
          "confidenceLevel": 0.95,
          "lower": 0,
          "upper": 0.7934506856227626
        },
        "falseCertaintyCount": 0,
        "falseCertaintyRate": 0,
        "falseCertaintyWilson95": {
          "confidenceLevel": 0.95,
          "lower": 0,
          "upper": 0.7934506856227626
        },
        "medianLatencyMs": 42.679124999999885,
        "p95LatencyMs": 42.679124999999885,
        "failureClassCounts": {
          "OCR_RECOGNITION_MISS": 1
        }
      },
      "field:brandName": {
        "caseCount": 11,
        "correctCount": 0,
        "accuracy": 0,
        "accuracyWilson95": {
          "confidenceLevel": 0.95,
          "lower": 0,
          "upper": 0.2588329669680317
        },
        "falseCertaintyCount": 0,
        "falseCertaintyRate": 0,
        "falseCertaintyWilson95": {
          "confidenceLevel": 0.95,
          "lower": 0,
          "upper": 0.2588329669680317
        },
        "medianLatencyMs": 81.55454099999997,
        "p95LatencyMs": 225.85037499999999,
        "failureClassCounts": {
          "OCR_RECOGNITION_MISS": 11
        }
      },
      "fixture-mode:committable": {
        "caseCount": 11,
        "correctCount": 0,
        "accuracy": 0,
        "accuracyWilson95": {
          "confidenceLevel": 0.95,
          "lower": 0,
          "upper": 0.2588329669680317
        },
        "falseCertaintyCount": 0,
        "falseCertaintyRate": 0,
        "falseCertaintyWilson95": {
          "confidenceLevel": 0.95,
          "lower": 0,
          "upper": 0.2588329669680317
        },
        "medianLatencyMs": 81.55454099999997,
        "p95LatencyMs": 225.85037499999999,
        "failureClassCounts": {
          "OCR_RECOGNITION_MISS": 11
        }
      },
      "image-orientation:landscape": {
        "caseCount": 2,
        "correctCount": 0,
        "accuracy": 0,
        "accuracyWilson95": {
          "confidenceLevel": 0.95,
          "lower": 0,
          "upper": 0.6576197724933469
        },
        "falseCertaintyCount": 0,
        "falseCertaintyRate": 0,
        "falseCertaintyWilson95": {
          "confidenceLevel": 0.95,
          "lower": 0,
          "upper": 0.6576197724933469
        },
        "medianLatencyMs": 105.79593749999998,
        "p95LatencyMs": 130.037334,
        "failureClassCounts": {
          "OCR_RECOGNITION_MISS": 2
        }
      },
      "image-orientation:portrait": {
        "caseCount": 9,
        "correctCount": 0,
        "accuracy": 0,
        "accuracyWilson95": {
          "confidenceLevel": 0.95,
          "lower": 2.7755575615628914e-17,
          "upper": 0.29914504841954404
        },
        "falseCertaintyCount": 0,
        "falseCertaintyRate": 0,
        "falseCertaintyWilson95": {
          "confidenceLevel": 0.95,
          "lower": 2.7755575615628914e-17,
          "upper": 0.29914504841954404
        },
        "medianLatencyMs": 75.37320799999998,
        "p95LatencyMs": 225.85037499999999,
        "failureClassCounts": {
          "OCR_RECOGNITION_MISS": 9
        }
      },
      "region-provenance:human-approved-region": {
        "caseCount": 11,
        "correctCount": 0,
        "accuracy": 0,
        "accuracyWilson95": {
          "confidenceLevel": 0.95,
          "lower": 0,
          "upper": 0.2588329669680317
        },
        "falseCertaintyCount": 0,
        "falseCertaintyRate": 0,
        "falseCertaintyWilson95": {
          "confidenceLevel": 0.95,
          "lower": 0,
          "upper": 0.2588329669680317
        },
        "medianLatencyMs": 81.55454099999997,
        "p95LatencyMs": 225.85037499999999,
        "failureClassCounts": {
          "OCR_RECOGNITION_MISS": 11
        }
      },
      "truth-source:human-approved-region": {
        "caseCount": 11,
        "correctCount": 0,
        "accuracy": 0,
        "accuracyWilson95": {
          "confidenceLevel": 0.95,
          "lower": 0,
          "upper": 0.2588329669680317
        },
        "falseCertaintyCount": 0,
        "falseCertaintyRate": 0,
        "falseCertaintyWilson95": {
          "confidenceLevel": 0.95,
          "lower": 0,
          "upper": 0.2588329669680317
        },
        "medianLatencyMs": 81.55454099999997,
        "p95LatencyMs": 225.85037499999999,
        "failureClassCounts": {
          "OCR_RECOGNITION_MISS": 11
        }
      }
    }
  },
  "cases": [
    {
      "caseId": "approved-wine-004",
      "fixtureId": "approved-wine-004",
      "slices": [
        "crop-min-dimension:large",
        "field:brandName",
        "fixture-mode:committable",
        "image-orientation:portrait",
        "region-provenance:human-approved-region",
        "truth-source:human-approved-region"
      ],
      "expectedValues": ["La Fattoria"],
      "rawTranscript": "Lo FAT TORIA",
      "rawWords": [
        {
          "text": "FAT",
          "rawConfidence": 38,
          "bbox": {
            "x0": 301,
            "y0": 627,
            "x1": 698,
            "y1": 864
          },
          "originalGeometry": {
            "imageIndex": 0,
            "x": 430,
            "y": 560,
            "width": 133,
            "height": 79,
            "imageWidth": 1350,
            "imageHeight": 1650
          }
        },
        {
          "text": "TORIA",
          "rawConfidence": 38,
          "bbox": {
            "x0": 842,
            "y0": 619,
            "x1": 1656,
            "y1": 864
          },
          "originalGeometry": {
            "imageIndex": 0,
            "x": 611,
            "y": 557,
            "width": 271,
            "height": 82,
            "imageWidth": 1350,
            "imageHeight": 1650
          }
        },
        {
          "text": "Lo",
          "rawConfidence": 22,
          "bbox": {
            "x0": 754,
            "y0": 83,
            "x1": 1707,
            "y1": 561
          },
          "originalGeometry": {
            "imageIndex": 0,
            "x": 581,
            "y": 379,
            "width": 318,
            "height": 159,
            "imageWidth": 1350,
            "imageHeight": 1650
          }
        }
      ],
      "meanConfidence": 32.666666666666664,
      "selectedValue": "FAT TORIA",
      "selectedState": "AMBIGUOUS",
      "reliable": false,
      "correct": false,
      "falseCertainty": false,
      "failureClass": "OCR_RECOGNITION_MISS",
      "candidateTrace": {
        "lines": [
          {
            "rawText": "Lo",
            "cleanedValue": "Lo",
            "confidence": 0.22,
            "prominence": 159,
            "regionName": "governed-brand-region",
            "passId": "research-approved-wine-004",
            "passKind": "seller-region",
            "kept": false,
            "reason": "low-information-fragment"
          },
          {
            "rawText": "FAT TORIA",
            "cleanedValue": "FAT TORIA",
            "confidence": 0.38,
            "prominence": 82,
            "regionName": "governed-brand-region",